{
  "artifact_type": "time_fact_v1",
  "schema_version": "1.0.0",
  "protocol_version": "1.0",
  "agreement_id": "agr-phase2-child",
  "revision_id": "rev-phase2-child",
  "time_fact_id": "tf-phase2-001",
  "source_id": "clock-phase2-001",
  "observed_at": "2026-03-19T02:00:00Z",
  "expires_at": "2026-03-19T03:00:00Z",
  "created_at": "2026-03-19T02:07:30Z"
}
